
*** Running vivado
    with args -log gpsSimulatedLynn_wrapper.vdi -applog -m64 -messageDb vivado.pb -mode batch -source gpsSimulatedLynn_wrapper.tcl -notrace


****** Vivado v2016.2 (64-bit)
  **** SW Build 1577090 on Thu Jun  2 16:32:40 MDT 2016
  **** IP Build 1577682 on Fri Jun  3 12:00:54 MDT 2016
    ** Copyright 1986-2016 Xilinx, Inc. All Rights Reserved.

source gpsSimulatedLynn_wrapper.tcl -notrace
Design is defaulting to srcset: sources_1
Design is defaulting to constrset: constrs_1
INFO: [Netlist 29-17] Analyzing 92 Unisim elements for replacement
INFO: [Netlist 29-28] Unisim Transformation completed in 1 CPU seconds
INFO: [Project 1-479] Netlist was created with Vivado 2016.2
INFO: [Device 21-403] Loading part xc7z020clg484-1
INFO: [Project 1-570] Preparing netlist for logic optimization
Parsing XDC File [f:/lynn.zheng/vivado_learing/GpsSimulatedLynn/GpsSimulatedLynn.srcs/sources_1/bd/gpsSimulatedLynn/ip/gpsSimulatedLynn_processing_system7_0_0/gpsSimulatedLynn_processing_system7_0_0.xdc] for cell 'gpsSimulatedLynn_i/processing_system7_0/inst'
Finished Parsing XDC File [f:/lynn.zheng/vivado_learing/GpsSimulatedLynn/GpsSimulatedLynn.srcs/sources_1/bd/gpsSimulatedLynn/ip/gpsSimulatedLynn_processing_system7_0_0/gpsSimulatedLynn_processing_system7_0_0.xdc] for cell 'gpsSimulatedLynn_i/processing_system7_0/inst'
Parsing XDC File [f:/lynn.zheng/vivado_learing/GpsSimulatedLynn/GpsSimulatedLynn.srcs/sources_1/bd/gpsSimulatedLynn/ip/gpsSimulatedLynn_axi_uartlite_0_0/gpsSimulatedLynn_axi_uartlite_0_0_board.xdc] for cell 'gpsSimulatedLynn_i/axi_uartlite_0/U0'
Finished Parsing XDC File [f:/lynn.zheng/vivado_learing/GpsSimulatedLynn/GpsSimulatedLynn.srcs/sources_1/bd/gpsSimulatedLynn/ip/gpsSimulatedLynn_axi_uartlite_0_0/gpsSimulatedLynn_axi_uartlite_0_0_board.xdc] for cell 'gpsSimulatedLynn_i/axi_uartlite_0/U0'
Parsing XDC File [f:/lynn.zheng/vivado_learing/GpsSimulatedLynn/GpsSimulatedLynn.srcs/sources_1/bd/gpsSimulatedLynn/ip/gpsSimulatedLynn_axi_uartlite_0_0/gpsSimulatedLynn_axi_uartlite_0_0.xdc] for cell 'gpsSimulatedLynn_i/axi_uartlite_0/U0'
Finished Parsing XDC File [f:/lynn.zheng/vivado_learing/GpsSimulatedLynn/GpsSimulatedLynn.srcs/sources_1/bd/gpsSimulatedLynn/ip/gpsSimulatedLynn_axi_uartlite_0_0/gpsSimulatedLynn_axi_uartlite_0_0.xdc] for cell 'gpsSimulatedLynn_i/axi_uartlite_0/U0'
Parsing XDC File [f:/lynn.zheng/vivado_learing/GpsSimulatedLynn/GpsSimulatedLynn.srcs/sources_1/bd/gpsSimulatedLynn/ip/gpsSimulatedLynn_rst_processing_system7_0_100M_0/gpsSimulatedLynn_rst_processing_system7_0_100M_0_board.xdc] for cell 'gpsSimulatedLynn_i/rst_processing_system7_0_100M/U0'
Finished Parsing XDC File [f:/lynn.zheng/vivado_learing/GpsSimulatedLynn/GpsSimulatedLynn.srcs/sources_1/bd/gpsSimulatedLynn/ip/gpsSimulatedLynn_rst_processing_system7_0_100M_0/gpsSimulatedLynn_rst_processing_system7_0_100M_0_board.xdc] for cell 'gpsSimulatedLynn_i/rst_processing_system7_0_100M/U0'
Parsing XDC File [f:/lynn.zheng/vivado_learing/GpsSimulatedLynn/GpsSimulatedLynn.srcs/sources_1/bd/gpsSimulatedLynn/ip/gpsSimulatedLynn_rst_processing_system7_0_100M_0/gpsSimulatedLynn_rst_processing_system7_0_100M_0.xdc] for cell 'gpsSimulatedLynn_i/rst_processing_system7_0_100M/U0'
Finished Parsing XDC File [f:/lynn.zheng/vivado_learing/GpsSimulatedLynn/GpsSimulatedLynn.srcs/sources_1/bd/gpsSimulatedLynn/ip/gpsSimulatedLynn_rst_processing_system7_0_100M_0/gpsSimulatedLynn_rst_processing_system7_0_100M_0.xdc] for cell 'gpsSimulatedLynn_i/rst_processing_system7_0_100M/U0'
Parsing XDC File [F:/lynn.zheng/vivado_learing/GpsSimulatedLynn/GpsSimulatedLynn.srcs/constrs_1/imports/new/system.xdc]
Finished Parsing XDC File [F:/lynn.zheng/vivado_learing/GpsSimulatedLynn/GpsSimulatedLynn.srcs/constrs_1/imports/new/system.xdc]
INFO: [Opt 31-138] Pushed 0 inverter(s) to 0 load pin(s).
INFO: [Project 1-111] Unisim Transformation Summary:
No Unisim elements were transformed.

link_design: Time (s): cpu = 00:00:11 ; elapsed = 00:00:12 . Memory (MB): peak = 605.895 ; gain = 374.945
Command: opt_design
Attempting to get a license for feature 'Implementation' and/or device 'xc7z020'
INFO: [Common 17-349] Got license for feature 'Implementation' and/or device 'xc7z020'
Running DRC as a precondition to command opt_design

Starting DRC Task
INFO: [DRC 23-27] Running DRC with 2 threads
INFO: [Project 1-461] DRC finished with 0 Errors
INFO: [Project 1-462] Please refer to the DRC report (report_drc) for more information.

Time (s): cpu = 00:00:00 ; elapsed = 00:00:00.278 . Memory (MB): peak = 610.492 ; gain = 4.598
INFO: [Timing 38-35] Done setting XDC timing constraints.

Starting Logic Optimization Task
Implement Debug Cores | Checksum: 1e9855c3f

Phase 1 Retarget
INFO: [Opt 31-138] Pushed 0 inverter(s) to 0 load pin(s).
INFO: [Opt 31-49] Retargeted 0 cell(s).
Phase 1 Retarget | Checksum: 19b2035dc

Time (s): cpu = 00:00:01 ; elapsed = 00:00:00.498 . Memory (MB): peak = 1047.715 ; gain = 0.000

Phase 2 Constant Propagation
INFO: [Opt 31-138] Pushed 0 inverter(s) to 0 load pin(s).
INFO: [Opt 31-10] Eliminated 64 cells.
Phase 2 Constant Propagation | Checksum: 1f88eeabb

Time (s): cpu = 00:00:01 ; elapsed = 00:00:00.839 . Memory (MB): peak = 1047.715 ; gain = 0.000

Phase 3 Sweep
INFO: [Opt 31-12] Eliminated 386 unconnected nets.
INFO: [Opt 31-11] Eliminated 258 unconnected cells.
Phase 3 Sweep | Checksum: 19e645a72

Time (s): cpu = 00:00:02 ; elapsed = 00:00:02 . Memory (MB): peak = 1047.715 ; gain = 0.000

Starting Connectivity Check Task

Time (s): cpu = 00:00:00 ; elapsed = 00:00:00.009 . Memory (MB): peak = 1047.715 ; gain = 0.000
Ending Logic Optimization Task | Checksum: 19e645a72

Time (s): cpu = 00:00:02 ; elapsed = 00:00:02 . Memory (MB): peak = 1047.715 ; gain = 0.000

Starting Power Optimization Task
INFO: [Pwropt 34-132] Skipping clock gating for clocks with a period < 2.00 ns.
Ending Power Optimization Task | Checksum: 19e645a72

Time (s): cpu = 00:00:00 ; elapsed = 00:00:00.082 . Memory (MB): peak = 1047.715 ; gain = 0.000
INFO: [Common 17-83] Releasing license: Implementation
20 Infos, 0 Warnings, 0 Critical Warnings and 0 Errors encountered.
opt_design completed successfully
opt_design: Time (s): cpu = 00:00:15 ; elapsed = 00:00:16 . Memory (MB): peak = 1047.715 ; gain = 441.820
Writing placer database...
Writing XDEF routing.
Writing XDEF routing logical nets.
Writing XDEF routing special nets.
Write XDEF Complete: Time (s): cpu = 00:00:00 ; elapsed = 00:00:00.134 . Memory (MB): peak = 1047.715 ; gain = 0.000
INFO: [DRC 23-27] Running DRC with 2 threads
INFO: [Coretcl 2-168] The results of DRC are in file F:/lynn.zheng/vivado_learing/GpsSimulatedLynn/GpsSimulatedLynn.runs/impl_1/gpsSimulatedLynn_wrapper_drc_opted.rpt.
INFO: [Chipscope 16-241] No debug cores found in the current design.
Before running the implement_debug_core command, either use the Set Up Debug wizard (GUI mode)
or use the create_debug_core and connect_debug_core Tcl commands to insert debug cores into the design.
Command: place_design
Attempting to get a license for feature 'Implementation' and/or device 'xc7z020'
INFO: [Common 17-349] Got license for feature 'Implementation' and/or device 'xc7z020'
INFO: [DRC 23-27] Running DRC with 2 threads
INFO: [Vivado_Tcl 4-198] DRC finished with 0 Errors
INFO: [Vivado_Tcl 4-199] Please refer to the DRC report (report_drc) for more information.
Running DRC as a precondition to command place_design
INFO: [DRC 23-27] Running DRC with 2 threads
INFO: [Vivado_Tcl 4-198] DRC finished with 0 Errors
INFO: [Vivado_Tcl 4-199] Please refer to the DRC report (report_drc) for more information.

Starting Placer Task
INFO: [Place 30-611] Multithreading enabled for place_design using a maximum of 2 CPUs

Phase 1 Placer Initialization
Netlist sorting complete. Time (s): cpu = 00:00:00 ; elapsed = 00:00:00.010 . Memory (MB): peak = 1047.715 ; gain = 0.000
Netlist sorting complete. Time (s): cpu = 00:00:00 ; elapsed = 00:00:00.006 . Memory (MB): peak = 1047.715 ; gain = 0.000

Phase 1.1 IO Placement/ Clock Placement/ Build Placer Device

Phase 1.1.1 ParallelPlaceIOClockAndInitTop

Phase 1.1.1.1 Pre-Place Cells
Phase 1.1.1.1 Pre-Place Cells | Checksum: a74ce353

Time (s): cpu = 00:00:00 ; elapsed = 00:00:00.155 . Memory (MB): peak = 1047.715 ; gain = 0.000

Phase 1.1.1.2 Constructing HAPIClkRuleMgr
Phase 1.1.1.2 Constructing HAPIClkRuleMgr | Checksum: a74ce353

Time (s): cpu = 00:00:01 ; elapsed = 00:00:00.746 . Memory (MB): peak = 1047.715 ; gain = 0.000
WARNING: [Place 30-879] Found overlapping PBlocks. The use of overlapping PBlocks is not recommended as it may lead to legalization errors or unplaced instances.
WARNING: [Place 30-12] An IO Bus FIXED_IO_mio with more than one IO standard is found. Components associated with this bus are: 
	FIXED_IO_mio[53] of IOStandard LVCMOS18
	FIXED_IO_mio[52] of IOStandard LVCMOS18
	FIXED_IO_mio[51] of IOStandard LVCMOS18
	FIXED_IO_mio[50] of IOStandard LVCMOS18
	FIXED_IO_mio[49] of IOStandard LVCMOS18
	FIXED_IO_mio[48] of IOStandard LVCMOS18
	FIXED_IO_mio[47] of IOStandard LVCMOS18
	FIXED_IO_mio[46] of IOStandard LVCMOS18
	FIXED_IO_mio[45] of IOStandard LVCMOS18
	FIXED_IO_mio[44] of IOStandard LVCMOS18
	FIXED_IO_mio[43] of IOStandard LVCMOS18
	FIXED_IO_mio[42] of IOStandard LVCMOS18
	FIXED_IO_mio[41] of IOStandard LVCMOS18
	FIXED_IO_mio[40] of IOStandard LVCMOS18
	FIXED_IO_mio[39] of IOStandard LVCMOS18
	FIXED_IO_mio[38] of IOStandard LVCMOS18
	FIXED_IO_mio[37] of IOStandard LVCMOS18
	FIXED_IO_mio[36] of IOStandard LVCMOS18
	FIXED_IO_mio[35] of IOStandard LVCMOS18
	FIXED_IO_mio[34] of IOStandard LVCMOS18
	FIXED_IO_mio[33] of IOStandard LVCMOS18
	FIXED_IO_mio[32] of IOStandard LVCMOS18
	FIXED_IO_mio[31] of IOStandard LVCMOS18
	FIXED_IO_mio[30] of IOStandard LVCMOS18
	FIXED_IO_mio[29] of IOStandard LVCMOS18
	FIXED_IO_mio[28] of IOStandard LVCMOS18
	FIXED_IO_mio[27] of IOStandard LVCMOS18
	FIXED_IO_mio[26] of IOStandard LVCMOS18
	FIXED_IO_mio[25] of IOStandard LVCMOS18
	FIXED_IO_mio[24] of IOStandard LVCMOS18
	FIXED_IO_mio[23] of IOStandard LVCMOS18
	FIXED_IO_mio[22] of IOStandard LVCMOS18
	FIXED_IO_mio[21] of IOStandard LVCMOS18
	FIXED_IO_mio[20] of IOStandard LVCMOS18
	FIXED_IO_mio[19] of IOStandard LVCMOS18
	FIXED_IO_mio[18] of IOStandard LVCMOS18
	FIXED_IO_mio[17] of IOStandard LVCMOS18
	FIXED_IO_mio[16] of IOStandard LVCMOS18
	FIXED_IO_mio[15] of IOStandard LVCMOS33
	FIXED_IO_mio[14] of IOStandard LVCMOS33
	FIXED_IO_mio[13] of IOStandard LVCMOS33
	FIXED_IO_mio[12] of IOStandard LVCMOS33
	FIXED_IO_mio[11] of IOStandard LVCMOS33
	FIXED_IO_mio[10] of IOStandard LVCMOS33
	FIXED_IO_mio[9] of IOStandard LVCMOS33
	FIXED_IO_mio[8] of IOStandard LVCMOS33
	FIXED_IO_mio[7] of IOStandard LVCMOS33
	FIXED_IO_mio[6] of IOStandard LVCMOS33
	FIXED_IO_mio[5] of IOStandard LVCMOS33
	FIXED_IO_mio[4] of IOStandard LVCMOS33
	FIXED_IO_mio[3] of IOStandard LVCMOS33
	FIXED_IO_mio[2] of IOStandard LVCMOS33
	FIXED_IO_mio[1] of IOStandard LVCMOS33
	FIXED_IO_mio[0] of IOStandard LVCMOS33
INFO: [Timing 38-35] Done setting XDC timing constraints.

Phase 1.1.1.3 IO and Clk Clean Up

Phase 1.1.1.3.1 Constructing HAPIClkRuleMgr
Phase 1.1.1.3.1 Constructing HAPIClkRuleMgr | Checksum: a74ce353

Time (s): cpu = 00:00:03 ; elapsed = 00:00:03 . Memory (MB): peak = 1058.105 ; gain = 10.391
Phase 1.1.1.3 IO and Clk Clean Up | Checksum: a74ce353

Time (s): cpu = 00:00:03 ; elapsed = 00:00:03 . Memory (MB): peak = 1058.105 ; gain = 10.391

Phase 1.1.1.4 Implementation Feasibility check On IDelay
Phase 1.1.1.4 Implementation Feasibility check On IDelay | Checksum: a74ce353

Time (s): cpu = 00:00:03 ; elapsed = 00:00:03 . Memory (MB): peak = 1058.105 ; gain = 10.391

Phase 1.1.1.5 Commit IO Placement
Phase 1.1.1.5 Commit IO Placement | Checksum: 85c0f506

Time (s): cpu = 00:00:03 ; elapsed = 00:00:03 . Memory (MB): peak = 1058.105 ; gain = 10.391
Phase 1.1.1 ParallelPlaceIOClockAndInitTop | Checksum: 85c0f506

Time (s): cpu = 00:00:03 ; elapsed = 00:00:03 . Memory (MB): peak = 1058.105 ; gain = 10.391
Phase 1.1 IO Placement/ Clock Placement/ Build Placer Device | Checksum: 142c8c12a

Time (s): cpu = 00:00:03 ; elapsed = 00:00:03 . Memory (MB): peak = 1058.105 ; gain = 10.391

Phase 1.2 Build Placer Netlist Model

Phase 1.2.1 Place Init Design

Phase 1.2.1.1 Make Others
Phase 1.2.1.1 Make Others | Checksum: 17bd8a458

Time (s): cpu = 00:00:03 ; elapsed = 00:00:04 . Memory (MB): peak = 1058.105 ; gain = 10.391

Phase 1.2.1.2 Init Lut Pin Assignment
Phase 1.2.1.2 Init Lut Pin Assignment | Checksum: 17bd8a458

Time (s): cpu = 00:00:03 ; elapsed = 00:00:04 . Memory (MB): peak = 1058.105 ; gain = 10.391
Phase 1.2.1 Place Init Design | Checksum: 1c13f901b

Time (s): cpu = 00:00:05 ; elapsed = 00:00:05 . Memory (MB): peak = 1058.105 ; gain = 10.391
Phase 1.2 Build Placer Netlist Model | Checksum: 1c13f901b

Time (s): cpu = 00:00:05 ; elapsed = 00:00:05 . Memory (MB): peak = 1058.105 ; gain = 10.391

Phase 1.3 Constrain Clocks/Macros
Phase 1.3 Constrain Clocks/Macros | Checksum: 1c13f901b

Time (s): cpu = 00:00:05 ; elapsed = 00:00:05 . Memory (MB): peak = 1058.105 ; gain = 10.391
Phase 1 Placer Initialization | Checksum: 1c13f901b

Time (s): cpu = 00:00:05 ; elapsed = 00:00:05 . Memory (MB): peak = 1058.105 ; gain = 10.391

Phase 2 Global Placement
Phase 2 Global Placement | Checksum: 1d449f988

Time (s): cpu = 00:00:08 ; elapsed = 00:00:08 . Memory (MB): peak = 1058.105 ; gain = 10.391

Phase 3 Detail Placement

Phase 3.1 Commit Multi Column Macros
Phase 3.1 Commit Multi Column Macros | Checksum: 1d449f988

Time (s): cpu = 00:00:08 ; elapsed = 00:00:08 . Memory (MB): peak = 1058.105 ; gain = 10.391

Phase 3.2 Commit Most Macros & LUTRAMs
Phase 3.2 Commit Most Macros & LUTRAMs | Checksum: 18ce6a2da

Time (s): cpu = 00:00:09 ; elapsed = 00:00:09 . Memory (MB): peak = 1058.105 ; gain = 10.391

Phase 3.3 Area Swap Optimization
Phase 3.3 Area Swap Optimization | Checksum: d1aae25d

Time (s): cpu = 00:00:09 ; elapsed = 00:00:09 . Memory (MB): peak = 1058.105 ; gain = 10.391

Phase 3.4 updateClock Trees: DP
Phase 3.4 updateClock Trees: DP | Checksum: d1aae25d

Time (s): cpu = 00:00:09 ; elapsed = 00:00:09 . Memory (MB): peak = 1058.105 ; gain = 10.391

Phase 3.5 Timing Path Optimizer
Phase 3.5 Timing Path Optimizer | Checksum: e5b8fa61

Time (s): cpu = 00:00:09 ; elapsed = 00:00:09 . Memory (MB): peak = 1058.105 ; gain = 10.391

Phase 3.6 Fast Optimization
Phase 3.6 Fast Optimization | Checksum: e5b8fa61

Time (s): cpu = 00:00:09 ; elapsed = 00:00:09 . Memory (MB): peak = 1058.105 ; gain = 10.391

Phase 3.7 Small Shape Detail Placement
Phase 3.7 Small Shape Detail Placement | Checksum: 177ab1398

Time (s): cpu = 00:00:11 ; elapsed = 00:00:10 . Memory (MB): peak = 1058.105 ; gain = 10.391

Phase 3.8 Re-assign LUT pins
Phase 3.8 Re-assign LUT pins | Checksum: 1824ded39

Time (s): cpu = 00:00:11 ; elapsed = 00:00:10 . Memory (MB): peak = 1058.105 ; gain = 10.391

Phase 3.9 Pipeline Register Optimization
Phase 3.9 Pipeline Register Optimization | Checksum: 1824ded39

Time (s): cpu = 00:00:11 ; elapsed = 00:00:10 . Memory (MB): peak = 1058.105 ; gain = 10.391

Phase 3.10 Fast Optimization
Phase 3.10 Fast Optimization | Checksum: 1824ded39

Time (s): cpu = 00:00:11 ; elapsed = 00:00:10 . Memory (MB): peak = 1058.105 ; gain = 10.391
Phase 3 Detail Placement | Checksum: 1824ded39

Time (s): cpu = 00:00:11 ; elapsed = 00:00:10 . Memory (MB): peak = 1058.105 ; gain = 10.391

Phase 4 Post Placement Optimization and Clean-Up

Phase 4.1 Post Commit Optimization
INFO: [Timing 38-35] Done setting XDC timing constraints.

Phase 4.1.1 updateClock Trees: PCOPT
Phase 4.1.1 updateClock Trees: PCOPT | Checksum: 1a0d4be67

Time (s): cpu = 00:00:12 ; elapsed = 00:00:11 . Memory (MB): peak = 1058.105 ; gain = 10.391

Phase 4.1.2 Post Placement Optimization
INFO: [Place 30-746] Post Placement Timing Summary WNS=3.341. For the most accurate timing information please run report_timing.
Phase 4.1.2 Post Placement Optimization | Checksum: efb7d793

Time (s): cpu = 00:00:12 ; elapsed = 00:00:11 . Memory (MB): peak = 1058.105 ; gain = 10.391
Phase 4.1 Post Commit Optimization | Checksum: efb7d793

Time (s): cpu = 00:00:12 ; elapsed = 00:00:11 . Memory (MB): peak = 1058.105 ; gain = 10.391

Phase 4.2 Sweep Clock Roots: Post-Placement
Phase 4.2 Sweep Clock Roots: Post-Placement | Checksum: efb7d793

Time (s): cpu = 00:00:12 ; elapsed = 00:00:11 . Memory (MB): peak = 1058.105 ; gain = 10.391

Phase 4.3 Uram Pipeline Register Optimization
Phase 4.3 Uram Pipeline Register Optimization | Checksum: efb7d793

Time (s): cpu = 00:00:12 ; elapsed = 00:00:11 . Memory (MB): peak = 1058.105 ; gain = 10.391

Phase 4.4 Post Placement Cleanup
Phase 4.4 Post Placement Cleanup | Checksum: efb7d793

Time (s): cpu = 00:00:12 ; elapsed = 00:00:11 . Memory (MB): peak = 1058.105 ; gain = 10.391

Phase 4.5 Placer Reporting
Phase 4.5 Placer Reporting | Checksum: efb7d793

Time (s): cpu = 00:00:12 ; elapsed = 00:00:11 . Memory (MB): peak = 1058.105 ; gain = 10.391

Phase 4.6 Final Placement Cleanup
Phase 4.6 Final Placement Cleanup | Checksum: 11bfffe4d

Time (s): cpu = 00:00:12 ; elapsed = 00:00:11 . Memory (MB): peak = 1058.105 ; gain = 10.391
Phase 4 Post Placement Optimization and Clean-Up | Checksum: 11bfffe4d

Time (s): cpu = 00:00:13 ; elapsed = 00:00:11 . Memory (MB): peak = 1058.105 ; gain = 10.391
Ending Placer Task | Checksum: cbadaf7d

Time (s): cpu = 00:00:13 ; elapsed = 00:00:11 . Memory (MB): peak = 1058.105 ; gain = 10.391
INFO: [Common 17-83] Releasing license: Implementation
35 Infos, 2 Warnings, 0 Critical Warnings and 0 Errors encountered.
place_design completed successfully
place_design: Time (s): cpu = 00:00:14 ; elapsed = 00:00:12 . Memory (MB): peak = 1058.105 ; gain = 10.391
Writing placer database...
Writing XDEF routing.
Writing XDEF routing logical nets.
Writing XDEF routing special nets.
Write XDEF Complete: Time (s): cpu = 00:00:01 ; elapsed = 00:00:00.412 . Memory (MB): peak = 1058.105 ; gain = 0.000
report_io: Time (s): cpu = 00:00:00 ; elapsed = 00:00:00.141 . Memory (MB): peak = 1058.105 ; gain = 0.000
report_utilization: Time (s): cpu = 00:00:00 ; elapsed = 00:00:00.047 . Memory (MB): peak = 1058.105 ; gain = 0.000
report_control_sets: Time (s): cpu = 00:00:00 ; elapsed = 00:00:00.013 . Memory (MB): peak = 1058.105 ; gain = 0.000
Command: route_design
Attempting to get a license for feature 'Implementation' and/or device 'xc7z020'
INFO: [Common 17-349] Got license for feature 'Implementation' and/or device 'xc7z020'
Running DRC as a precondition to command route_design
INFO: [DRC 23-27] Running DRC with 2 threads
WARNING: [DRC 23-20] Rule violation (PLIO-7) Placement Constraints Check for IO constraints - An IO Bus FIXED_IO_mio[53:0] with more than one IO standard is found. Components associated with this bus are: LVCMOS18 (FIXED_IO_mio[53], FIXED_IO_mio[52], FIXED_IO_mio[51], FIXED_IO_mio[50], FIXED_IO_mio[49], FIXED_IO_mio[48], FIXED_IO_mio[47], FIXED_IO_mio[46], FIXED_IO_mio[45], FIXED_IO_mio[44], FIXED_IO_mio[43], FIXED_IO_mio[42], FIXED_IO_mio[41], FIXED_IO_mio[40], FIXED_IO_mio[39] (the first 15 of 38 listed)); LVCMOS33 (FIXED_IO_mio[15], FIXED_IO_mio[14], FIXED_IO_mio[13], FIXED_IO_mio[12], FIXED_IO_mio[11], FIXED_IO_mio[10], FIXED_IO_mio[9], FIXED_IO_mio[8], FIXED_IO_mio[7], FIXED_IO_mio[6], FIXED_IO_mio[5], FIXED_IO_mio[4], FIXED_IO_mio[3], FIXED_IO_mio[2], FIXED_IO_mio[1] (the first 15 of 16 listed)); 
INFO: [Vivado_Tcl 4-198] DRC finished with 0 Errors, 1 Warnings
INFO: [Vivado_Tcl 4-199] Please refer to the DRC report (report_drc) for more information.


Starting Routing Task
INFO: [Route 35-254] Multithreading enabled for route_design using a maximum of 2 CPUs
Checksum: PlaceDB: 6d295c83 ConstDB: 0 ShapeSum: 5e8452fa RouteDB: 0

Phase 1 Build RT Design
Phase 1 Build RT Design | Checksum: 74d0be76

Time (s): cpu = 00:00:38 ; elapsed = 00:00:35 . Memory (MB): peak = 1195.355 ; gain = 137.250

Phase 2 Router Initialization

Phase 2.1 Create Timer
Phase 2.1 Create Timer | Checksum: 74d0be76

Time (s): cpu = 00:00:38 ; elapsed = 00:00:35 . Memory (MB): peak = 1195.355 ; gain = 137.250

Phase 2.2 Fix Topology Constraints
Phase 2.2 Fix Topology Constraints | Checksum: 74d0be76

Time (s): cpu = 00:00:38 ; elapsed = 00:00:35 . Memory (MB): peak = 1195.355 ; gain = 137.250

Phase 2.3 Pre Route Cleanup
Phase 2.3 Pre Route Cleanup | Checksum: 74d0be76

Time (s): cpu = 00:00:38 ; elapsed = 00:00:35 . Memory (MB): peak = 1195.355 ; gain = 137.250
 Number of Nodes with overlaps = 0

Phase 2.4 Update Timing
Phase 2.4 Update Timing | Checksum: 17b0e1a17

Time (s): cpu = 00:00:40 ; elapsed = 00:00:36 . Memory (MB): peak = 1195.355 ; gain = 137.250
INFO: [Route 35-416] Intermediate Timing Summary | WNS=3.391  | TNS=0.000  | WHS=-0.193 | THS=-21.018|

Phase 2 Router Initialization | Checksum: 174e96e17

Time (s): cpu = 00:00:40 ; elapsed = 00:00:36 . Memory (MB): peak = 1195.355 ; gain = 137.250

Phase 3 Initial Routing
Phase 3 Initial Routing | Checksum: f5d2d301

Time (s): cpu = 00:00:41 ; elapsed = 00:00:37 . Memory (MB): peak = 1195.355 ; gain = 137.250

Phase 4 Rip-up And Reroute

Phase 4.1 Global Iteration 0
 Number of Nodes with overlaps = 236
 Number of Nodes with overlaps = 2
 Number of Nodes with overlaps = 1
 Number of Nodes with overlaps = 0

Phase 4.1.1 Update Timing
Phase 4.1.1 Update Timing | Checksum: 130775f8a

Time (s): cpu = 00:00:43 ; elapsed = 00:00:38 . Memory (MB): peak = 1195.355 ; gain = 137.250
INFO: [Route 35-416] Intermediate Timing Summary | WNS=2.924  | TNS=0.000  | WHS=N/A    | THS=N/A    |

Phase 4.1 Global Iteration 0 | Checksum: 1681bec1f

Time (s): cpu = 00:00:43 ; elapsed = 00:00:38 . Memory (MB): peak = 1195.355 ; gain = 137.250
Phase 4 Rip-up And Reroute | Checksum: 1681bec1f

Time (s): cpu = 00:00:43 ; elapsed = 00:00:38 . Memory (MB): peak = 1195.355 ; gain = 137.250

Phase 5 Delay and Skew Optimization

Phase 5.1 Delay CleanUp

Phase 5.1.1 Update Timing
Phase 5.1.1 Update Timing | Checksum: 13f4a17ee

Time (s): cpu = 00:00:43 ; elapsed = 00:00:38 . Memory (MB): peak = 1195.355 ; gain = 137.250
INFO: [Route 35-416] Intermediate Timing Summary | WNS=2.938  | TNS=0.000  | WHS=N/A    | THS=N/A    |

Phase 5.1 Delay CleanUp | Checksum: 13f4a17ee

Time (s): cpu = 00:00:43 ; elapsed = 00:00:38 . Memory (MB): peak = 1195.355 ; gain = 137.250

Phase 5.2 Clock Skew Optimization
Phase 5.2 Clock Skew Optimization | Checksum: 13f4a17ee

Time (s): cpu = 00:00:43 ; elapsed = 00:00:38 . Memory (MB): peak = 1195.355 ; gain = 137.250
Phase 5 Delay and Skew Optimization | Checksum: 13f4a17ee

Time (s): cpu = 00:00:43 ; elapsed = 00:00:38 . Memory (MB): peak = 1195.355 ; gain = 137.250

Phase 6 Post Hold Fix

Phase 6.1 Hold Fix Iter

Phase 6.1.1 Update Timing
Phase 6.1.1 Update Timing | Checksum: 1f4a4023c

Time (s): cpu = 00:00:43 ; elapsed = 00:00:38 . Memory (MB): peak = 1195.355 ; gain = 137.250
INFO: [Route 35-416] Intermediate Timing Summary | WNS=2.938  | TNS=0.000  | WHS=0.043  | THS=0.000  |

Phase 6.1 Hold Fix Iter | Checksum: 1b58226be

Time (s): cpu = 00:00:43 ; elapsed = 00:00:38 . Memory (MB): peak = 1195.355 ; gain = 137.250
Phase 6 Post Hold Fix | Checksum: 1b58226be

Time (s): cpu = 00:00:43 ; elapsed = 00:00:38 . Memory (MB): peak = 1195.355 ; gain = 137.250

Phase 7 Route finalize

Router Utilization Summary
  Global Vertical Routing Utilization    = 0.396603 %
  Global Horizontal Routing Utilization  = 0.444726 %
  Routable Net Status*
  *Does not include unroutable nets such as driverless and loadless.
  Run report_route_status for detailed report.
  Number of Failed Nets               = 0
  Number of Unrouted Nets             = 0
  Number of Partially Routed Nets     = 0
  Number of Node Overlaps             = 0

Phase 7 Route finalize | Checksum: 141602be7

Time (s): cpu = 00:00:43 ; elapsed = 00:00:38 . Memory (MB): peak = 1195.355 ; gain = 137.250

Phase 8 Verifying routed nets

 Verification completed successfully
Phase 8 Verifying routed nets | Checksum: 141602be7

Time (s): cpu = 00:00:43 ; elapsed = 00:00:38 . Memory (MB): peak = 1195.355 ; gain = 137.250

Phase 9 Depositing Routes
Phase 9 Depositing Routes | Checksum: 10847a756

Time (s): cpu = 00:00:44 ; elapsed = 00:00:38 . Memory (MB): peak = 1195.355 ; gain = 137.250

Phase 10 Post Router Timing
INFO: [Route 35-57] Estimated Timing Summary | WNS=2.938  | TNS=0.000  | WHS=0.043  | THS=0.000  |

INFO: [Route 35-327] The final timing numbers are based on the router estimated timing analysis. For a complete and accurate timing signoff, please run report_timing_summary.
Phase 10 Post Router Timing | Checksum: 10847a756

Time (s): cpu = 00:00:44 ; elapsed = 00:00:38 . Memory (MB): peak = 1195.355 ; gain = 137.250
INFO: [Route 35-16] Router Completed Successfully

Time (s): cpu = 00:00:44 ; elapsed = 00:00:38 . Memory (MB): peak = 1195.355 ; gain = 137.250

Routing Is Done.
INFO: [Common 17-83] Releasing license: Implementation
48 Infos, 3 Warnings, 0 Critical Warnings and 0 Errors encountered.
route_design completed successfully
route_design: Time (s): cpu = 00:00:46 ; elapsed = 00:00:39 . Memory (MB): peak = 1195.355 ; gain = 137.250
Writing placer database...
Writing XDEF routing.
Writing XDEF routing logical nets.
Writing XDEF routing special nets.
Write XDEF Complete: Time (s): cpu = 00:00:01 ; elapsed = 00:00:00.485 . Memory (MB): peak = 1195.355 ; gain = 0.000
INFO: [DRC 23-27] Running DRC with 2 threads
INFO: [Coretcl 2-168] The results of DRC are in file F:/lynn.zheng/vivado_learing/GpsSimulatedLynn/GpsSimulatedLynn.runs/impl_1/gpsSimulatedLynn_wrapper_drc_routed.rpt.
INFO: [Timing 38-91] UpdateTimingParams: Speed grade: -1, Delay Type: min_max.
INFO: [Timing 38-191] Multithreading enabled for timing update using a maximum of 2 CPUs
Running Vector-less Activity Propagation...

Finished Running Vector-less Activity Propagation
Attempting to get a license for feature 'Implementation' and/or device 'xc7z020'
INFO: [Common 17-349] Got license for feature 'Implementation' and/or device 'xc7z020'
Running DRC as a precondition to command write_bitstream
INFO: [DRC 23-27] Running DRC with 2 threads
INFO: [Vivado 12-3199] DRC finished with 0 Errors
INFO: [Vivado 12-3200] Please refer to the DRC report (report_drc) for more information.
INFO: [Designutils 20-2272] Running write_bitstream with 2 threads.
Loading data files...
Loading site data...
Loading route data...
Processing options...
Creating bitmap...
Creating bitstream...
Writing bitstream ./gpsSimulatedLynn_wrapper.bit...
INFO: [Vivado 12-1842] Bitgen Completed Successfully.
INFO: [Project 1-120] WebTalk data collection is mandatory when using a WebPACK part without a full Vivado license. To see the specific WebTalk data collected for your design, open the usage_statistics_webtalk.html or usage_statistics_webtalk.xml file in the implementation directory.
INFO: [Common 17-83] Releasing license: Implementation
write_bitstream: Time (s): cpu = 00:00:25 ; elapsed = 00:00:27 . Memory (MB): peak = 1530.180 ; gain = 334.824
INFO: [Common 17-206] Exiting Vivado at Wed Nov 23 17:52:53 2016...
